{
  "version": 1,
  "generated_from_round": "round-009",
  "authority": "advisory_coverage_only",
  "summary": "Coverage ladder connecting roadmap organisms to runtime-supported atom sequences, preview fixture evidence, and remaining blockers. This artifact is advisory and does not promote organism names to public capabilities.",
  "coverage_tiers": [
    {
      "tier": "preview_fixture",
      "meaning": "At least one representative organism preview runs through workbookcase using supported atoms and operation-specific verifiers."
    },
    {
      "tier": "supported_atom_plan",
      "meaning": "The organism can be decomposed into currently supported atoms, but no organism preview fixture proves the composition yet."
    },
    {
      "tier": "blocked_by_planned_atom",
      "meaning": "The organism depends on at least one planned atom that is intentionally outside the supported runtime registry."
    },
    {
      "tier": "advisory_only_gap",
      "meaning": "The organism remains useful as a research hint, but its core workbook behavior lacks a supported atom sequence."
    }
  ],
  "organisms": [
    {
      "organism_id": "invoice_line_item_billing",
      "fixture_priority": "p0",
      "coverage_tier": "preview_fixture",
      "executable_sequence_atom_ids": ["append_structured_rows", "extend_table_formulas", "add_data_validation", "protect_formula_cells", "generate_printable_form"],
      "planned_blocker_atom_ids": [],
      "preview_evidence": ["TestInvoiceLineItemBillingPreviewComposesAppendFormulaExtensionValidationAndProtection"],
      "coverage_claim": "Representative invoice row input, calculation, validation, formula protection, and printable form materialization are executable.",
      "remaining_gaps": ["supplier/customer lookup enrichment is supported but not in this preview", "full document layout inference is not supported"],
      "next_promotion_gate": "Add an organism-level verifier that checks metadata, line totals, printable region, and protected summary in one acceptance pass."
    },
    {
      "organism_id": "expense_reimbursement",
      "fixture_priority": "p1",
      "coverage_tier": "preview_fixture",
      "executable_sequence_atom_ids": ["append_structured_rows", "extend_table_formulas", "add_data_validation", "protect_formula_cells", "generate_printable_form"],
      "planned_blocker_atom_ids": [],
      "preview_evidence": ["TestExpenseReimbursementPreviewComposesAppendFormulasAndPrintableForm"],
      "coverage_claim": "Representative reimbursement row append, reimbursable formula extension, and printable claim materialization are executable.",
      "remaining_gaps": ["validation and protection are supported but not in this preview", "policy eligibility checks are not supported as a separate gate"],
      "next_promotion_gate": "Create a fixture that appends expense rows, extends reimbursable totals, validates categories, protects totals, and emits a printable claim."
    },
    {
      "organism_id": "purchase_order_control",
      "fixture_priority": "p1",
      "coverage_tier": "preview_fixture",
      "executable_sequence_atom_ids": ["join_lookup", "append_structured_rows", "extend_table_formulas", "add_data_validation", "generate_printable_form"],
      "planned_blocker_atom_ids": [],
      "preview_evidence": ["TestPurchaseOrderControlPreviewComposesLookupAndStatusValidation"],
      "coverage_claim": "Representative purchase-order supplier lookup and status validation are executable.",
      "remaining_gaps": ["line totals and printable PO generation are supported but not in this preview", "multi-document receipt/invoice matching belongs to procurement reconciliation"],
      "next_promotion_gate": "Create a PO fixture that enriches supplier metadata, appends line items, validates status, and generates a printable PO sheet."
    },
    {
      "organism_id": "monthly_budget_control",
      "fixture_priority": "p0",
      "coverage_tier": "preview_fixture",
      "executable_sequence_atom_ids": ["group_summarize", "highlight_threshold"],
      "planned_blocker_atom_ids": [],
      "preview_evidence": ["TestMonthlyBudgetControlPreviewComposesSummaryAndThreshold"],
      "coverage_claim": "Representative budget summary and over-budget threshold exception handling are executable.",
      "remaining_gaps": ["period copy, roll-forward, formula extension, and protected summary are supported but not in this preview as one organism flow"],
      "next_promotion_gate": "Create an organism-level fixture that copies a month, carries closing values, extends formulas, highlights variance, and protects summaries."
    },
    {
      "organism_id": "cash_flow_monitor",
      "fixture_priority": "p0",
      "coverage_tier": "preview_fixture",
      "executable_sequence_atom_ids": ["roll_forward_period"],
      "planned_blocker_atom_ids": [],
      "preview_evidence": ["TestCashFlowMonitorPreviewComposesRollForwardPeriod"],
      "coverage_claim": "Representative closing-to-opening balance continuity is executable.",
      "remaining_gaps": ["full cash-flow table summarization and protected dashboard regions are not proven in one organism flow"],
      "next_promotion_gate": "Create an organism-level fixture that combines period copy, roll-forward, formula preservation, summary checks, and protection."
    },
    {
      "organism_id": "attendance_register",
      "fixture_priority": "p0",
      "coverage_tier": "preview_fixture",
      "executable_sequence_atom_ids": ["copy_period_sheet", "add_data_validation", "protect_formula_cells"],
      "planned_blocker_atom_ids": [],
      "preview_evidence": ["TestAttendanceRegisterPreviewComposesCopyValidationAndProtection"],
      "coverage_claim": "Representative attendance period copy, status dropdown validation, and formula protection are executable.",
      "remaining_gaps": ["matrix auto-growth and calendar projection are advisory molecule gaps", "header normalization is supported but not in this preview"],
      "next_promotion_gate": "Create an organism-level verifier for roster/date growth, status validation, totals, and protected helper regions."
    },
    {
      "organism_id": "timesheet_hours_log",
      "fixture_priority": "p0",
      "coverage_tier": "preview_fixture",
      "executable_sequence_atom_ids": ["copy_period_sheet"],
      "planned_blocker_atom_ids": [],
      "preview_evidence": ["TestTimesheetHoursLogPreviewComposesPeriodCopy"],
      "coverage_claim": "Representative period sheet copy with formula preservation is executable.",
      "remaining_gaps": ["row append, formula extension, validation, and protection are supported but not proven together in this organism preview"],
      "next_promotion_gate": "Create a timesheet fixture that copies a period, appends hours, extends pay formulas, validates allowed fields, and protects totals."
    },
    {
      "organism_id": "project_timeline_tracker",
      "fixture_priority": "p1",
      "coverage_tier": "preview_fixture",
      "executable_sequence_atom_ids": ["copy_period_sheet", "extend_table_formulas", "add_data_validation", "group_summarize"],
      "planned_blocker_atom_ids": [],
      "preview_evidence": ["TestProjectTimelineTrackerPreviewComposesPeriodCopyAndStatusValidation"],
      "coverage_claim": "Representative project timeline period copy and task status validation are executable.",
      "remaining_gaps": ["timeline grid projection does not have a dedicated runtime atom", "formula extension and summaries are supported but not in this preview"],
      "next_promotion_gate": "Create a fixture that updates task rows and proves timeline/status summary behavior with the existing supported atom subset."
    },
    {
      "organism_id": "shift_roster_planner",
      "fixture_priority": "p1",
      "coverage_tier": "preview_fixture",
      "executable_sequence_atom_ids": ["copy_period_sheet", "add_data_validation", "protect_formula_cells", "normalize_headers", "group_summarize"],
      "planned_blocker_atom_ids": [],
      "preview_evidence": ["TestShiftRosterPlannerPreviewComposesPeriodCopyAndShiftValidation"],
      "coverage_claim": "Representative shift roster period copy and shift-code validation are executable.",
      "remaining_gaps": ["conflict detection and coverage gap projection lack dedicated organism-level verification", "protected totals, header cleanup, and summary are supported but not in this preview"],
      "next_promotion_gate": "Create a shift roster fixture that copies a period, validates shift codes, summarizes coverage, and protects summary formulas."
    },
    {
      "organism_id": "construction_cost_tracker",
      "fixture_priority": "p1",
      "coverage_tier": "preview_fixture",
      "executable_sequence_atom_ids": ["append_structured_rows", "group_summarize", "highlight_threshold", "roll_forward_period", "protect_formula_cells"],
      "planned_blocker_atom_ids": [],
      "preview_evidence": ["TestConstructionCostTrackerPreviewComposesAppendAndThreshold"],
      "coverage_claim": "Representative construction cost row append and overrun threshold highlighting are executable.",
      "remaining_gaps": ["earned-value style timeline projection is not supported", "cumulative summary, roll-forward, and protected totals are supported but not in this preview"],
      "next_promotion_gate": "Create a fixture that appends cost/change rows, summarizes actuals, flags variance, and preserves protected forecast formulas."
    },
    {
      "organism_id": "inventory_movement_log",
      "fixture_priority": "p0",
      "coverage_tier": "preview_fixture",
      "executable_sequence_atom_ids": ["normalize_headers", "reconcile_tables"],
      "planned_blocker_atom_ids": [],
      "preview_evidence": ["TestInventoryMovementLogPreviewComposesHeaderNormalization", "TestInventoryMovementLogPreviewComposesTableReconciliation"],